{
  "schema_version": "1.0",
  "tool": "ego-webqa",
  "target": "http://127.0.0.1:45669/index.html",
  "status": "warn",
  "failed_items": [
    {
      "dimension_id": "transfer_budget",
      "dimension_version": "1.0.0",
      "detector": "network",
      "default_severity": "block",
      "severity": "warn",
      "selector": "html",
      "selectors": [],
      "text_snippet": "",
      "trigger": "mobile-360-100-safe0 (360x800); mobile-360-100-safe34 (360x800); mobile-360-150-safe0 (360x800); mobile-360-150-safe34 (360x800); mobile-390-100-safe0 (390x844); mobile-390-100-safe34 (390x844); mobile-390-150-safe0 (390x844); mobile-390-150-safe34 (390x844)",
      "triggers": [
        "mobile-360-100-safe0 (360x800)",
        "mobile-360-100-safe34 (360x800)",
        "mobile-360-150-safe0 (360x800)",
        "mobile-360-150-safe34 (360x800)",
        "mobile-390-100-safe0 (390x844)",
        "mobile-390-100-safe34 (390x844)",
        "mobile-390-150-safe0 (390x844)",
        "mobile-390-150-safe34 (390x844)"
      ],
      "problem": "initial load transferred 710KB in 2 requests",
      "problems": [
        "initial load transferred 710KB in 2 requests"
      ],
      "suggestion": "Reduce the above-the-fold payload (budget: 400KB/30 requests).",
      "reproduce": "ego-webqa --dir /srv/projects/ego_webqa/dogfood-results/repair-vocabulary/src --file index.html --viewports '360x800:mobile-360-100-safe0,360x800:mobile-360-100-safe34~34,360x800:mobile-360-150-safe0@1.5,360x800:mobile-360-150-safe34@1.5~34,390x844:mobile-390-100-safe0,390x844:mobile-390-100-safe34~34,390x844:mobile-390-150-safe0@1.5,390x844:mobile-390-150-safe34@1.5~34' --browser-channel chrome --no-smoke --json",
      "occurrences": 8,
      "evidence": {
        "bytes": 709839,
        "requests": 2
      },
      "evidence_by_viewport": {
        "mobile-360-100-safe0": [
          {
            "bytes": 709839,
            "requests": 2
          }
        ],
        "mobile-360-100-safe34": [
          {
            "bytes": 709839,
            "requests": 2
          }
        ],
        "mobile-360-150-safe0": [
          {
            "bytes": 709839,
            "requests": 2
          }
        ],
        "mobile-360-150-safe34": [
          {
            "bytes": 709839,
            "requests": 2
          }
        ],
        "mobile-390-100-safe0": [
          {
            "bytes": 709839,
            "requests": 2
          }
        ],
        "mobile-390-100-safe34": [
          {
            "bytes": 709839,
            "requests": 2
          }
        ],
        "mobile-390-150-safe0": [
          {
            "bytes": 709839,
            "requests": 2
          }
        ],
        "mobile-390-150-safe34": [
          {
            "bytes": 709839,
            "requests": 2
          }
        ]
      }
    }
  ],
  "summary": {
    "total_block": 0,
    "total_warn": 8,
    "unique_root_causes": 1,
    "affected_viewports": 8,
    "duration_ms": 2597,
    "overridden_dimensions": 0,
    "downgraded_blocks": 0,
    "expired_overrides": 0
  },
  "scope_statement": "本报告仅覆盖多终端几何与基础体验的确定性粗检；业务主路径、跨浏览器兼容、安全合规需另行验证。"
}
